{
  "id": "utility.larkmoor-480y277-1000kva",
  "version": 1,
  "title": "480Y/277 V three-phase utility service, 1000 kVA transformer",
  "brand": "Larkmoor Power",
  "modelName": "LP-3W1000",
  "category": "source",
  "sizeMm": { "widthMm": 400, "heightMm": 300, "depthMm": 200 },
  "terminals": [
    { "id": "l1", "label": "L1", "positionMm": { "x": 50, "y": 250, "z": 200 } },
    { "id": "l2", "label": "L2", "positionMm": { "x": 150, "y": 250, "z": 200 } },
    { "id": "l3", "label": "L3", "positionMm": { "x": 250, "y": 250, "z": 200 } },
    { "id": "n", "label": "N", "positionMm": { "x": 350, "y": 250, "z": 200 } }
  ],
  "model": {
    "kind": "utility.threePhase",
    "params": { "ratedKva": 1000, "percentImpedance": 5.75, "xOverR": 6, "lineToNeutralV": 277 }
  },
  "controls": [],
  "sources": [
    {
      "id": "industrial-transformer-class",
      "kind": "real-world",
      "citation": "A three-phase liquid-filled substation or pad-mounted transformer for an industrial plant: 1000 kVA, with an impedance of 5.75 %, a long-standing typical value for the size, and an X/R ratio of about 5–7, from published manufacturers' data and short-circuit study guides (paraphrased, not one vendor's). An X/R of 6 is taken: per phase 0.0575 × (√3 × 277)² / 1 000 000 = 13.2 mΩ, about 20.9 kA of bolted three-phase fault current.",
      "covers": ["model.params.ratedKva", "model.params.percentImpedance", "model.params.xOverR"]
    },
    {
      "id": "wye-480-nominal",
      "kind": "real-world",
      "citation": "277 V from each phase to the neutral of the 480Y/277 V three-phase four-wire nominal system of ANSI C84.1-2020 (the region profile's industrial system); 480 V is the rounded name of 277 × √3 = 479.78 V.",
      "covers": ["model.params.lineToNeutralV"]
    },
    {
      "id": "headless-layout",
      "kind": "game-design",
      "citation": "game-design: a placeholder size and terminal layout. Three-phase service is headless in P2 (gameplay is P6), so it is not drawn.",
      "covers": ["sizeMm", "terminals"]
    }
  ],
  "extensions": {}
}
