{
  "id": "fuse.emberlyn-5x20-fa-1a",
  "version": 1,
  "title": "1 A fast-acting 5 × 20 mm fuse in an inline holder on a base",
  "brand": "Emberlyn",
  "modelName": "EF-520-1A",
  "category": "protection",
  "sizeMm": {
    "widthMm": 70,
    "heightMm": 30,
    "depthMm": 30
  },
  "terminals": [
    {
      "id": "a",
      "label": "1",
      "positionMm": {
        "x": 8,
        "y": 15,
        "z": 12
      }
    },
    {
      "id": "b",
      "label": "2",
      "positionMm": {
        "x": 62,
        "y": 15,
        "z": 12
      }
    }
  ],
  "model": {
    "kind": "fuse",
    "params": {
      "ratedCurrentA": 1,
      "meltingI2tA2s": 0.7,
      "minimumFusingRatio": 1.2,
      "elementFraction": 0.3,
      "bodyTimeConstantS": 10,
      "resistanceOhm": 0.1
    }
  },
  "controls": [],
  "sources": [
    {
      "id": "fast-acting-5x20-class",
      "kind": "real-world",
      "citation": "The 1 A fast-acting 5 × 20 mm glass cartridge fuse, a common supplemental-protection class listed to UL 248-14. Typical published figures for the class, paraphrased (not one vendor's): a cold resistance of about 0.1 Ω and a nominal melting I²t of roughly 0.5 to 1 A²·s (0.7 A²·s is taken).",
      "covers": ["model.params.ratedCurrentA", "model.params.meltingI2tA2s", "model.params.resistanceOhm"]
    },
    {
      "id": "opening-time-band",
      "kind": "game-design",
      "citation": "game-design inside UL 248-14's envelope for supplemental fuses (paraphrased): carries its rating, opens within an hour at 135 % and two minutes at 200 %. The fictional datasheet's band, tested: carries 110 %; 135 %: 1 s to 1 h; 200 %: 0.1 to 5 s; 1000 %: 1 to 20 ms. I_min of 1.2 × the rating, between 1 and 1.35 as the envelope requires.",
      "covers": ["model.params.minimumFusingRatio"]
    },
    {
      "id": "two-body-melt",
      "kind": "game-design",
      "citation": "game-design: a fast element taking 30 % of the steady temperature rise inside a slow body (end caps and holder) of 10 s time constant, the element's own time constant (0.151 s) following from the melting I²t (electrical-realism-reviewer's worked example). It gives about 12 s at 135 %, 0.9 s at 200 % and 7 ms at 1000 %, near published fast-acting curves.",
      "covers": ["model.params.elementFraction", "model.params.bodyTimeConstantS"]
    },
    {
      "id": "holder-layout",
      "kind": "game-design",
      "citation": "game-design: an inline fuse holder on a 70 × 30 mm base, 30 mm tall, with a screw terminal at each end; not modelled on a product. Replacing the fuse in P2 means deleting it and placing a new one.",
      "covers": ["sizeMm", "terminals"]
    }
  ],
  "extensions": {}
}
