{
  "id": "utility.larkmoor-208y120-150kva",
  "version": 1,
  "title": "208Y/120 V three-phase utility service, 150 kVA transformer",
  "brand": "Larkmoor Power",
  "modelName": "LP-3W150",
  "category": "source",
  "sizeMm": { "widthMm": 400, "heightMm": 300, "depthMm": 200 },
  "terminals": [
    { "id": "l1", "label": "L1", "positionMm": { "x": 50, "y": 250, "z": 200 } },
    { "id": "l2", "label": "L2", "positionMm": { "x": 150, "y": 250, "z": 200 } },
    { "id": "l3", "label": "L3", "positionMm": { "x": 250, "y": 250, "z": 200 } },
    { "id": "n", "label": "N", "positionMm": { "x": 350, "y": 250, "z": 200 } }
  ],
  "model": {
    "kind": "utility.threePhase",
    "params": { "ratedKva": 150, "percentImpedance": 4, "xOverR": 3, "lineToNeutralV": 120 }
  },
  "controls": [],
  "sources": [
    {
      "id": "commercial-transformer-class",
      "kind": "real-world",
      "citation": "A three-phase pad-mounted distribution transformer for a small commercial building: 150 kVA, with an impedance of about 2–5 % and an X/R ratio of about 2–4, typical of published manufacturers' data for the size (paraphrased, not one vendor's). 4 % and an X/R of 3 are taken: per phase 0.04 × (√3 × 120)² / 150 000 = 11.5 mΩ, about 10.4 kA of bolted three-phase fault current, the infinite-primary (transformer-limited) available fault current: an upper bound, with no utility system impedance.",
      "covers": ["model.params.ratedKva", "model.params.percentImpedance", "model.params.xOverR"]
    },
    {
      "id": "wye-208-nominal",
      "kind": "real-world",
      "citation": "120 V from each phase to the neutral of the 208Y/120 V three-phase four-wire nominal system of ANSI C84.1-2020 (the region profile's commercial system); 208 V is the rounded name of 120 × √3 = 207.85 V.",
      "covers": ["model.params.lineToNeutralV"]
    },
    {
      "id": "headless-layout",
      "kind": "game-design",
      "citation": "game-design: a placeholder size and terminal layout. Three-phase service is headless in P2 (gameplay is P6), so it is not drawn.",
      "covers": ["sizeMm", "terminals"]
    }
  ],
  "extensions": {}
}
